{
    "reference_resolution": [1280, 720],
    "description": "占位布局。进入真实战斗盘面后统一校准一次。",
    "fixed": {
        "play_area": [640, 430],
        "hand_expand": [1025, 665],
        "puzzle_confirm": [1135, 500],
        "puzzle_reset": [105, 220],
        "puzzle_reward_continue": [640, 650],
        "puzzle_list_top": [430, 260],
        "puzzle_list_bottom": [430, 570],
        "puzzle_category_arrow_probe": [500, 14],
        "ally_leader": [640, 620],
        "enemy_leader": [640, 70],
        "dialog_advance": [640, 635],
        "mulligan_confirm": [1150, 360],
        "mulligan_card_anchor": [640, 520],
        "mulligan_replace_anchor": [640, 210],
        "dungeon_stage_first": [640, 400],
        "dungeon_deck_decide": [770, 550],
        "extra_energy": [1165, 515],
        "end_turn": [1170, 320]
    },
    "regions": {
        "hand_and_board": [240, 300, 800, 410],
        "mulligan_selection": [150, 100, 800, 540],
        "battle_board": [300, 140, 680, 420],
        "enemy_follower_stats": [250, 245, 780, 65],
        "ally_follower_stats": [250, 405, 780, 80],
        "enemy_leader_health": [728, 28, 60, 62],
        "ally_leader_health": [744, 545, 66, 62],
        "ally_leader_health_expanded": [748, 500, 66, 55]
    },
    "indexed": {
        "hand": {
            "1": [[675, 665]],
            "2": [[600, 665], [750, 665]],
            "3": [[530, 665], [640, 665], [750, 665]],
            "4": [[475, 665], [585, 665], [695, 665], [805, 665]],
            "5": [[420, 665], [530, 665], [640, 665], [750, 665], [860, 665]],
            "6": [[365, 665], [475, 665], [585, 665], [695, 665], [805, 665], [915, 665]],
            "7": [[330, 665], [430, 665], [530, 665], [630, 665], [730, 665], [830, 665], [930, 665]],
            "8": [[295, 665], [390, 665], [485, 665], [580, 665], [675, 665], [770, 665], [865, 665], [960, 665]],
            "9": [[260, 665], [350, 665], [440, 665], [530, 665], [620, 665], [710, 665], [800, 665], [890, 665], [980, 665]]
        },
        "ally_followers": {
            "1": [[640, 465]],
            "2": [[550, 465], [730, 465]],
            "3": [[460, 465], [640, 465], [820, 465]],
            "4": [[400, 465], [560, 465], [720, 465], [880, 465]],
            "5": [[320, 465], [480, 465], [640, 465], [800, 465], [960, 465]]
        },
        "enemy_followers": {
            "1": [[640, 265]],
            "2": [[550, 265], [730, 265]],
            "3": [[460, 265], [640, 265], [820, 265]],
            "4": [[400, 265], [560, 265], [720, 265], [880, 265]],
            "5": [[320, 265], [480, 265], [640, 265], [800, 265], [960, 265]]
        },
        "choices": {
            "2": [[770, 305], [770, 415]]
        }
    }
}
